{
  "task": "3.3 - Equipment System",
  "timestamp": "2025-11-01T00:00:00Z",
  "planFilesValidated": true,
  "planMatch": true,
  "filesCreated": [
    "Assets/Scripts/DataModels/Equipment/EquipmentRarity.cs",
    "Assets/Scripts/DataModels/Equipment/EquipmentSlotType.cs",
    "Assets/Scripts/DataModels/Equipment/EquipmentData.cs",
    "Assets/Scripts/ScriptableObjects/Equipment/EquipmentDefinition.cs",
    "Assets/Scripts/Services/IEquipmentService.cs",
    "Assets/Scripts/Services/EquipmentManager.cs",
    "Assets/Tests/EquipmentTests/EquipmentManagerTests.cs"
  ],
  "filesEdited": [],
  "decisions": [
    {
      "context": "Shape of cardModifiers and statModifiers",
      "decision": "Implemented minimal typed containers (CardModifier, StatModifier) to keep runtime simple",
      "rationale": "Plan requested typed modifiers; keeping them minimal avoids large refactors and eases later expansion"
    }
  ],
  "buildStatus": "success",
  "buildOutput": null,
  "tests": {
    "executed": false,
    "summary": null,
    "failures": []
  },
  "error": null
}
