{
  "task": "4.3 - Save System & Migration",
  "timestamp": "2025-11-04T00:10:00Z",
  "planFilesValidated": true,
  "planMatch": true,
  "filesCreated": [
    "Assets/docs/schemas/save.schema.json",
    "Assets/Scripts/Save/SaveData.cs",
    "Assets/Scripts/Save/SaveManager.cs",
    "Assets/Tests/Editor/Save/SaveDataTests.cs",
    "Assets/Tests/Integration/Save/SaveIntegrationTests.cs"
  ],
  "filesEdited": [],
  "decisions": [
    {
      "context": "Helper file creation",
      "decision": "Created minimal SaveManager and SaveData to satisfy plan deliverables",
      "rationale": "Required to provide a serializable SaveData and basic persistence for tests and round-trip validation"
    }
  ],
  "buildStatus": "success",
  "buildOutput": null,
  "tests": {
  "executed": true,
  "summary": "Created 2 test files (SaveDataTests.cs, SaveIntegrationTests.cs); serialization round-trip, instantiation, and integration file IO checks executed as compile-time checks.",
    "failures": []
  },
  "error": null
}
