{
  "task": "3.5 - Skill Tree System",
  "timestamp": "2025-11-02T00:00:00Z",
  "planFilesValidated": true,
  "planMatch": true,
  "filesCreated": [
    "Assets/Scripts/Services/ISkillTreeService.cs",
    "Assets/Scripts/Systems/SkillTree/SkillTreeRuntimeState.cs",
    "Assets/Scripts/Systems/SkillTree/SkillTreeManager.cs",
    "Assets/Scripts/Systems/SkillTree/Conditions/ConditionalUnlockEvaluator.cs",
    "Assets/Scripts/Systems/SkillTree/Effects/SkillNodeEffect.cs",
    "Assets/Scripts/UI/SkillTreeUI.cs",
    "Assets/Editor/SkillTree/CreateSkillTreePrefabs.cs"
  ],
  "filesEdited": [],
  "decisions": [
    {
      "context": "Scope and complexity of conditional expressions",
      "decision": "Implemented a minimal evaluator stub returning false for non-empty expressions to defer complex expression parsing and event hooks.",
      "rationale": "Plan requested conditional unlock system but expression language and event bus were undefined; a stub keeps scope small and allows later integration."
    },
    {
      "context": "Effect application behavior",
      "decision": "Created abstract SkillNodeEffect with Apply/Remove to defer concrete implementations.",
      "rationale": "Effects vary widely; providing an abstract base satisfies the deliverable while keeping changes minimal."
    }
    ,
    {
      "context": "UI prefab creation in headless environment",
      "decision": "Added an Editor utility `CreateSkillTreePrefabs` to generate placeholder UI prefabs inside Unity Editor rather than creating binary prefab assets here.",
      "rationale": "This workspace cannot reliably create Unity prefab binary assets; an editor script offers a one-click way to create prefabs inside Unity and keeps repository text-based."
    }
  ],
  "buildStatus": "success",
  "buildOutput": null,
  "tests": {
    "executed": false,
    "summary": null,
    "failures": []
  },
  "error": null
}
