{
  "task": "JSON Import & Validation Tool",
  "timestamp": "2025-11-01T12:00:00Z",
  "planFilesValidated": true,
  "planMatch": true,
  "filesCreated": [
    "Assets/Editor/Tools/JsonImportValidator.cs",
    "Assets/docs/plans/json-import-validation-tool/validation-report.md",
    "Assets/docs/plans/json-import-validation-tool/summary.md",
    "Assets/Tests/Editor/EditorTools/JsonImportValidatorTests_Extended.cs",
    "Assets/docs/plans/json-import-validation-tool/test-plan.md",
    "Assets/docs/plans/json-import-validation-tool/test-report.json"
  ],
  "filesEdited": [],
  "decisions": [
    {
      "context": "Schema validation library",
      "decision": "Implemented a minimal dry-run JSON parser instead of integrating Newtonsoft.Json.Schema to avoid adding new package/dependency in this commit.",
      "rationale": "Keep scope minimal; full schema validation can be added in follow-up where license and package management are considered."
    }
    ,
    {
      "context": "Review step",
      "decision": "Recorded review findings in review-report.md and adjusted changes-log to remove self-reference.",
      "rationale": "Improve clarity of changes-log and capture review activity."
    }
    ,
    {
      "context": "Test placement",
      "decision": "Created Editor test file Assets/Tests/Editor/EditorTools/JsonImportValidatorTests_Extended.cs to validate file parsing and dry-run logic.",
      "rationale": "JsonImportValidator is an EditorWindow and tests belong under Assets/Tests/Editor; created an _Extended test file to follow project conventions and avoid task-scoped test folders."
    }
  ],
  "buildStatus": "success",
  "buildOutput": null,
  "tests": {
    "executed": false,
    "summary": "No tests executed during this implementation; recommended follow-up: add unit tests for JSON->ScriptableObject conversion.",
    "failures": []
  },
  "error": null
}
