{
  "task": "4.2 - Meta Progression (Optional)",
  "timestamp": "2025-11-04T01:00:00Z",
  "planFilesValidated": true,
  "planMatch": true,
  "filesCreated": [
    "Assets/docs/schemas/meta-progression.schema.json",
    "Assets/Scripts/DataModels/Meta/MetaProgressionData.cs",
    "Assets/Scripts/Services/Save/MetaProgressionService.cs",
    "Assets/Editor/SaveTools/MetaProgressionTool.cs",
  "Assets/Tests/Editor/DataModels/MetaProgressionDataTests.cs",
  "Assets/Tests/Integration/Services/MetaProgressionServiceTests.cs"
  ],
  "filesEdited": [],
  "decisions": [
    { "context": "Helper file creation", "decision": "Created MetaProgressionService.cs", "rationale": "Required for load/save deliverable; not listed verbatim in plan but implied." }
  ],
  "buildStatus": "success",
  "buildOutput": null,
  "tests": {
    "executed": false,
    "summary": "0 tests executed here (compile-only). Created 1 editor test and 1 integration test; execution pending in Unity Test Runner.",
    "failures": []
  },
  "error": null
}
