{
  "task": "3.4 - Blessing System",
  "timestamp": "2025-11-01T12:00:00Z",
  "planFilesValidated": true,
  "planMatch": true,
  "filesCreated": [
    "Assets/Scripts/DataModels/BlessingDefinition.cs",
    "Assets/Scripts/Systems/BlessingManager.cs",
    "Assets/Editor/Importers/BlessingJsonImporter.cs",
    "Assets/docs/plans/blessing-system/plan.md",
    "Assets/docs/plans/blessing-system/plan.json"
  ],
  "filesEdited": [],
  "decisions": [
    {
      "context": "Ambiguous requirement scope for importer UI",
      "decision": "Added a lightweight Editor menu command that imports a JSON file to a Resources path.",
      "rationale": "Keeps importer minimal, zero-dependency, and editor-only as required by scope enforcement."
    }
  ],
  "buildStatus": "error",
  "buildOutput": "Build not executed in this environment. Open the project in Unity Editor to compile scripts and run tests.",
  "tests": {
    "executed": false,
    "summary": null,
    "failures": []
  },
  "error": "Build not executed here; environment cannot run Unity Editor. See 'buildOutput' for next steps."
}
