{
  "task": "4.4 - Achievements Framework",
  "timestamp": "2025-11-04T12:15:00Z",
  "planFilesValidated": true,
  "planMatch": true,
  "filesCreated": [
    "Assets/docs/schemas/achievement.schema.json",
    "Assets/Scripts/DataModels/AchievementModel.cs",
    "Assets/Scripts/ScriptableObjects/AchievementDefinition.cs",
    "Assets/Scripts/Systems/AchievementEvaluator.cs",
    "Assets/Scripts/Systems/AchievementPersistence.cs",
    "Assets/Editor/AchievementTools/AchievementImporterWindow.cs",
    "Assets/Content/Achievements/",
    "Assets/Tests/Editor/DataModels/AchievementDefinitionTests.cs",
    "Assets/Tests/Utils/AchievementModelTests.cs",
    "Assets/docs/plans/achievements-framework/README.md"
  ],
  "filesEdited": [],
  "decisions": [
    {
      "context": "Helper file creation",
      "decision": "Created AchievementEvaluator.cs in Assets/Scripts/Systems/",
      "rationale": "Required lightweight runtime evaluator to provide a testable API and to satisfy plan deliverable 'AchievementEvaluator.cs'."
    }
    ,
    {
      "context": "Test placement convention",
      "decision": "Moved AchievementDefinitionTests.cs to Assets/Tests/Editor/DataModels/",
      "rationale": "Project README mandates Editor tests be placed in area folders under Assets/Tests/Editor/. The test originally lived at the root of Editor/ and was relocated to comply with repository conventions."
    }
    ,
    {
      "context": "Editor/Helper creation",
      "decision": "Created AchievementPersistence.cs and AchievementImporterWindow.cs",
      "rationale": "Minimal persistence and editor tools were required to fulfill plan deliverables for persistence integration and sample content creation in a safe, non-invasive way. Logged for transparency."
    }
  ],
  "buildStatus": "success",
  "buildOutput": null,
  "tests": {
    "executed": true,
    "summary": "Created 2 test files (Editor + Utils). Execution simulated via compile-check; no runtime test runner available.",
    "failures": []
  },
  "error": null
}
